Date,Site,Title,Score,Reason
2025-12-23,AI Internship,Siemens AI Student,Geospatial AI Engineer (Part-Time),8,"Matches Master's in AI, Geoinformatics background, ML/CV expertise, and Geospatial AI/Digital Twins focus. The 20h/week constraint for Austria is met. DJI Mavic 2 Pro experience is a plus for data acquisition."
2025-12-23,AI Internship,Siemens AI Student,"Computer Vision Engineer (Remote, Part-Time)",7,"Strong alignment with CV expertise and AI background. Remote roles are unrestricted by the 20h/week limit, allowing for flexibility. Geospatial focus is a good fit but not explicitly required."
2025-12-23,AI Internship,Siemens AI Student,"Data Scientist (Geospatial Focus, Remote)",7,Leverages AI background and potential for ML/CV application. Geospatial focus is a strong match. Remote role allows for flexibility beyond the 20h/week constraint if needed for a full-time role.
2025-12-23,AI Internship,AI Austria,Senior Data Scientist/ML Engineer/AI Engineer (f/m/x),9,Matches ML expertise and AI focus. Location Vienna is acceptable. Assumed to be around 20h/week or negotiable.
2025-12-23,AI Internship,AI Austria,Senior AI/Computer Scientist for Agentic Systems,8,Matches AI focus. Agentic systems can overlap with AI applications in geospatial data. Location Vienna is acceptable. Assumed to be around 20h/week or negotiable.
2025-12-23,AI Internship,AI Austria,AI-Driven Full-Stack Engineer (w/m/d),7,General AI role. Could apply to geospatial data. Location Vienna is acceptable. Assumed to be around 20h/week or negotiable.
2025-12-23,AI Internship,AI Austria,Artificial Intelligence Engineer,8,Direct AI engineering role. Highly relevant. Location Vienna is acceptable. Assumed to be around 20h/week or negotiable.
2025-12-23,AI Internship,AI Austria,"AI Engineer (f,m,d – remote)",9,Direct AI engineering role. Remote is unrestricted. Matches expertise well.
2025-12-23,AI Internship,AI Austria,Head of AI (fully remote),7,"Leadership role in AI. Might be too senior, but remote is unrestricted and AI focus is strong. Potential for relevant projects."
2025-12-23,AI Internship,AI Austria,"Full-Stack Engineer with LLMs, Agentic Workflows Experience",7,LLMs and agentic workflows are advanced AI techniques that can be applied to geospatial problems. Remote is unrestricted.
2025-12-23,AI Internship,AI Austria,AI Solution Architect,7,AI focus. Architect role could involve designing geospatial AI solutions. Location Vienna is acceptable. Assumed to be around 20h/week or negotiable.
2025-12-23,AI Internship,AI Austria,Applied AI Engineer,9,Directly matches AI expertise and application focus. Location Vienna is acceptable. Assumed to be around 20h/week or negotiable.
2025-12-23,AI Internship,AI Austria,Data Scientist (m/f/d),8,Matches ML expertise. Can be applied to geospatial data. Location Vienna is acceptable. Assumed to be around 20h/week or negotiable.
2025-12-23,AI Internship,AI Austria,Junior AI Engineer,8,Entry-level AI role. Directly matches AI expertise. Location Vienna is acceptable. Assumed to be around 20h/week or negotiable.
2025-12-23,AI Internship,AI Austria,PostDoc researcher (f/m/d) for AI in Environmental Simulation,7,AI focus. Environmental simulation can overlap with geospatial applications. Location Vienna is acceptable. Assumed to be around 20h/week or negotiable.
2025-12-23,AI Internship,AI Austria,Data Scientist,8,Matches ML expertise. Can be applied to geospatial data. Location Vienna is acceptable. Assumed to be around 20h/week or negotiable.
2025-12-23,AI Internship,AI Austria,Data/ML Eng,9,Directly matches ML expertise. Location Vienna is acceptable. Assumed to be around 20h/week or negotiable.
2025-12-23,AI Internship,AI Austria,Process/Data Science Eng,8,Data science expertise is a strong match. Process engineering could relate to geospatial workflows. Location Vienna is acceptable. Assumed to be around 20h/week or negotiable.
2025-12-23,AI Internship,AI Austria,Senior AI Developer,9,Directly matches AI expertise. Location Vienna is acceptable. Assumed to be around 20h/week or negotiable.
2025-12-23,AI Internship,AI Austria,IT-Consultant Artificial Intelligence,7,AI consulting role. Could be applied to geospatial AI projects. Locations Wien/Graz are acceptable. Assumed to be around 20h/week or negotiable.
2025-12-23,AI Internship,AI Austria,Data Scientist (w/m/d) mit Schwerpunkt LLMs & Agentic Workflows,8,LLMs and agentic workflows are advanced AI techniques that can be applied to geospatial problems. Location Hagenberg is acceptable. Assumed to be around 20h/week or negotiable.
2025-12-23,AI Internship,AI Austria,Data Scientist (w/m/d) mit Schwerpunkt Computer Vision,10,"Directly matches Computer Vision expertise, which is highly relevant to photogrammetry and point clouds. Location Hagenberg is acceptable. Assumed to be around 20h/week or negotiable."
2025-12-23,AI Internship,AI Austria,Senior AI Developer / Data Scientist,9,Directly matches AI and Data Scientist expertise. Locations Wien/Linz/Wels are acceptable. Assumed to be around 20h/week or negotiable.
2025-12-23,AI Internship,AI Austria,Artificial Intelligence Consulting,7,AI consulting role. Could be applied to geospatial AI projects. Location Vienna is acceptable. Assumed to be around 20h/week or negotiable.
2025-12-23,AI Internship,AI Austria,Univ.-Ass (mit Doktorat),7,"Academic research assistant role. With a Master's, could potentially fit if research aligns with AI and geospatial data. Location Vienna is acceptable. Assumed to be around 20h/week or negotiable."
